{
  "$schema": "../../../schemas/design-v2.schema.json",
  "schemaVersion": 2,
  "tokens": {
    "colors": {
      "brand": {
        "400": "#8b7cff",
        "500": "#6d5cff",
        "600": "#5948dc"
      }
    },
    "space": {
      "18": 72
    },
    "textSizes": {
      "display": {
        "size": 36,
        "lineHeight": 44
      }
    },
    "fontWeights": {
      "book": 350
    },
    "fontFamilies": {
      "brand": [
        "Inter",
        "Sans Serif"
      ]
    },
    "tracking": {
      "brand": 0.04
    },
    "radius": {
      "card": 14
    },
    "shadows": {
      "card": {
        "color": "#30000000",
        "offsetX": 0,
        "offsetY": 6,
        "blur": 20,
        "spread": 0
      }
    },
    "opacity": {
      "quiet": 0.42
    },
    "durations": {
      "deliberate": 420
    },
    "easings": {
      "expressive": [
        0.2,
        0.8,
        0.2,
        1
      ]
    },
    "breakpoints": {
      "2xl": 1536
    },
    "containers": {
      "card": 420
    }
  },
  "themes": {
    "light": {
      "tokens": {
        "colors": {
          "accent": "brand-600"
        }
      }
    },
    "dark": {
      "tokens": {
        "colors": {
          "accent": "brand-400"
        },
        "shadows": {
          "card": {
            "color": "#88000000",
            "offsetX": 0,
            "offsetY": 8,
            "blur": 28,
            "spread": 0
          }
        },
        "radius": {
          "card": 18
        }
      }
    },
    "violet": {
      "extends": "dark",
      "tokens": {
        "colors": {
          "background": "#171126",
          "surface": "#241a3a",
          "surface-alt": "#30234a",
          "outline": "#594879",
          "accent": "brand-400"
        }
      }
    }
  },
  "theme": {
    "default": "system",
    "light": "light",
    "dark": "dark"
  },
  "styles": {
    "card": "bg-surface border border-outline rounded-card shadow-card",
    "pill": "px-3 h-9 rounded-full bg-surface-alt text-sm font-medium",
    "state-card": "bg-surface border border-outline rounded-lg w-56 h-20 transition-colors"
  },
  "lint": {
    "arbitraryValues": "warn"
  },
  "iconRoot": "qrc:/gallery/icons/"
}
